<?xml version="1.0" encoding="utf-8"?>
<!-- Copyright (C) 2010 The Android Open Source Project
     Copyright (c) 2012, Code Aurora Forum. All rights reserved.

     Licensed under the Apache License, Version 2.0 (the "License");
     you may not use this file except in compliance with the License.
     You may obtain a copy of the License at

          http://www.apache.org/licenses/LICENSE-2.0

     Unless required by applicable law or agreed to in writing, software
     distributed under the License is distributed on an "AS IS" BASIS,
     WITHOUT WARRANTIES OR CONDITIONS OF ANY KIND, either express or implied.
     See the License for the specific language governing permissions and
     limitations under the License.
-->
<!DOCTYPE MediaSettings [
  <!ELEMENT MediaSettings (CamcorderProfiles,
                         EncoderOutputFileFormat+,
                         VideoEncoderCap+,
                         AudioEncoderCap+,
                         VideoDecoderCap,
                         AudioDecoderCap,
                         VideoEditorCap,
                         ExportVideoProfile)>
  <!ELEMENT CamcorderProfiles (EncoderProfile+, ImageEncoding+, ImageDecoding, Camera)>
  <!ELEMENT EncoderProfile (Video, Audio)>
  <!ATTLIST EncoderProfile quality (timelapse1080p|timelapse720p|timelapse480p|timelapsehigh|timelapselow|timelapseqvga|480p|qcif|high|low) #REQUIRED>
  <!ATTLIST EncoderProfile fileFormat (mp4|3gp) #REQUIRED>
  <!ATTLIST EncoderProfile duration (30|60) #REQUIRED>
  <!ELEMENT Video EMPTY>
  <!ATTLIST Video codec (h264|h263|m4v) #REQUIRED>
  <!ATTLIST Video bitRate CDATA #REQUIRED>
  <!ATTLIST Video width CDATA #REQUIRED>
  <!ATTLIST Video height CDATA #REQUIRED>
  <!ATTLIST Video frameRate CDATA #REQUIRED>
  <!ELEMENT Audio EMPTY>
  <!ATTLIST Audio codec (amrnb|amrwb|aac|lpcm) #REQUIRED>
  <!ATTLIST Audio bitRate CDATA #REQUIRED>
  <!ATTLIST Audio sampleRate CDATA #REQUIRED>
  <!ATTLIST Audio channels (1|2|6) #REQUIRED>
  <!ELEMENT ImageEncoding EMPTY>
  <!ATTLIST ImageEncoding quality (90|80|70|60|50|40) #REQUIRED>
  <!ELEMENT ImageDecoding EMPTY>
  <!ATTLIST ImageDecoding memCap CDATA #REQUIRED>
  <!ELEMENT Camera EMPTY>
  <!ATTLIST Camera previewFrameRate CDATA #REQUIRED>
  <!ELEMENT EncoderOutputFileFormat EMPTY>
  <!ATTLIST EncoderOutputFileFormat name (mp4|3gp) #REQUIRED>
  <!ELEMENT VideoEncoderCap EMPTY>
  <!ATTLIST VideoEncoderCap name (h264|h263|m4v|wmv) #REQUIRED>
  <!ATTLIST VideoEncoderCap enabled (true|false) #REQUIRED>
  <!ATTLIST VideoEncoderCap minBitRate CDATA #REQUIRED>
  <!ATTLIST VideoEncoderCap maxBitRate CDATA #REQUIRED>
  <!ATTLIST VideoEncoderCap minFrameWidth CDATA #REQUIRED>
  <!ATTLIST VideoEncoderCap maxFrameWidth CDATA #REQUIRED>
  <!ATTLIST VideoEncoderCap minFrameHeight CDATA #REQUIRED>
  <!ATTLIST VideoEncoderCap maxFrameHeight CDATA #REQUIRED>
  <!ATTLIST VideoEncoderCap minFrameRate CDATA #REQUIRED>
  <!ATTLIST VideoEncoderCap maxFrameRate CDATA #REQUIRED>
  <!ELEMENT AudioEncoderCap EMPTY>
  <!ATTLIST AudioEncoderCap name (amrnb|amrwb|aac|wma|lpcm) #REQUIRED>
  <!ATTLIST AudioEncoderCap enabled (true|false) #REQUIRED>
  <!ATTLIST AudioEncoderCap minBitRate CDATA #REQUIRED>
  <!ATTLIST AudioEncoderCap maxBitRate CDATA #REQUIRED>
  <!ATTLIST AudioEncoderCap minSampleRate CDATA #REQUIRED>
  <!ATTLIST AudioEncoderCap maxSampleRate CDATA #REQUIRED>
  <!ATTLIST AudioEncoderCap minChannels (1|2|6) #REQUIRED>
  <!ATTLIST AudioEncoderCap maxChannels (1|2|6) #REQUIRED>
  <!ELEMENT VideoDecoderCap EMPTY>
  <!ATTLIST VideoDecoderCap name (wmv) #REQUIRED>
  <!ATTLIST VideoDecoderCap enabled (true|false) #REQUIRED>
  <!ELEMENT AudioDecoderCap EMPTY>
  <!ATTLIST AudioDecoderCap name (wma) #REQUIRED>
  <!ATTLIST AudioDecoderCap enabled (true|false) #REQUIRED>
  <!ELEMENT VideoEditorCap EMPTY>
  <!ATTLIST VideoEditorCap maxInputFrameWidth CDATA #REQUIRED>
  <!ATTLIST VideoEditorCap maxInputFrameHeight CDATA #REQUIRED>
  <!ATTLIST VideoEditorCap maxOutputFrameWidth CDATA #REQUIRED>
  <!ATTLIST VideoEditorCap maxOutputFrameHeight CDATA #REQUIRED>
  <!ATTLIST VideoEditorCap maxPrefetchYUVFrames CDATA #REQUIRED>
  <!ELEMENT ExportVideoProfile EMPTY>
  <!ATTLIST ExportVideoProfile name (h263|h264|m4v) #REQUIRED>
  <!ATTLIST ExportVideoProfile profile CDATA #REQUIRED>
  <!ATTLIST ExportVideoProfile level CDATA #REQUIRED>
]>
<!--
     This file is used to declare the multimedia profiles and capabilities
     on an android-powered device.
-->
<MediaSettings>
  <!-- Each camcorder profile defines a set of predefined configuration parameters -->
  <!-- Back Camera -->
  <CamcorderProfiles cameraId="0">

    <EncoderProfile quality="low" fileFormat="3gp" duration="30">
      <Video codec="h264"
             bitRate="192000"
             width="176"
             height="144"
             frameRate="30" />

      <Audio codec="amrnb"
             bitRate="12200"
             sampleRate="8000"
             channels="1" />
    </EncoderProfile>

    <EncoderProfile quality="high" fileFormat="3gp" duration="30">
      <Video codec="h264"
             bitRate="2000000"
             width="720"
             height="480"
             frameRate="30" />

      <Audio codec="aac"
             bitRate="96000"
             sampleRate="16000"
             channels="1" />
    </EncoderProfile>

    <EncoderProfile quality="qcif" fileFormat="3gp" duration="30">
      <Video codec="h264"
             bitRate="192000"
             width="176"
             height="144"
             frameRate="30" />

      <Audio codec="amrnb"
             bitRate="12200"
             sampleRate="8000"
             channels="1" />
    </EncoderProfile>

    <EncoderProfile quality="cif" fileFormat="3gp" duration="30">
      <Video codec="h264"
             bitRate="720000"
             width="352"
             height="288"
             frameRate="30" />

      <Audio codec="amrnb"
             bitRate="12200"
             sampleRate="8000"
             channels="1" />
    </EncoderProfile>

    <EncoderProfile quality="480p" fileFormat="3gp" duration="30">
      <Video codec="h264"
             bitRate="2000000"
             width="720"
             height="480"
             frameRate="30" />

      <Audio codec="aac"
             bitRate="96000"
             sampleRate="16000"
             channels="1" />
    </EncoderProfile>

    <EncoderProfile quality="fwvga" fileFormat="3gp" duration="30">
      <Video codec="h264"
             bitRate="2000000"
             width="864"
             height="480"
             frameRate="30" />

      <Audio codec="aac"
             bitRate="96000"
             sampleRate="16000"
             channels="1" />
    </EncoderProfile>

    <EncoderProfile quality="wvga" fileFormat="3gp" duration="30">
      <Video codec="h264"
             bitRate="2000000"
             width="800"
             height="480"
             frameRate="30" />

      <Audio codec="aac"
             bitRate="96000"
             sampleRate="16000"
             channels="1" />
    </EncoderProfile>

     <EncoderProfile quality="vga" fileFormat="3gp" duration="30">
      <Video codec="h264"
             bitRate="2000000"
             width="640"
             height="480"
             frameRate="30" />

      <Audio codec="aac"
             bitRate="96000"
             sampleRate="16000"
             channels="1" />
    </EncoderProfile>

     <EncoderProfile quality="wqvga" fileFormat="3gp" duration="30">
      <Video codec="h264"
             bitRate="720000"
             width="432"
             height="240"
             frameRate="30" />

      <Audio codec="aac"
             bitRate="96000"
             sampleRate="16000"
             channels="1" />
    </EncoderProfile>

        <EncoderProfile quality="qvga" fileFormat="3gp" duration="30">
      <Video codec="h264"
             bitRate="512000"
             width="320"
             height="240"
             frameRate="30" />

      <Audio codec="aac"
             bitRate="96000"
             sampleRate="16000"
             channels="1" />
    </EncoderProfile>

    <EncoderProfile quality="timelapselow" fileFormat="3gp" duration="30">
      <Video codec="h264"
             bitRate="192000"
             width="176"
             height="144"
             frameRate="30" />

      <Audio codec="amrnb"
             bitRate="12200"
             sampleRate="8000"
             channels="1" />
    </EncoderProfile>

    <EncoderProfile quality="timelapsehigh" fileFormat="3gp" duration="30">
      <Video codec="h264"
             bitRate="2000000"
             width="640"
             height="480"
             frameRate="30" />

      <Audio codec="aac"
             bitRate="96000"
             sampleRate="16000"
             channels="1" />
    </EncoderProfile>

    <EncoderProfile quality="timelapseqcif" fileFormat="3gp" duration="30">
      <Video codec="h264"
             bitRate="192000"
             width="176"
             height="144"
             frameRate="30" />

      <Audio codec="amrnb"
             bitRate="12200"
             sampleRate="8000"
             channels="1" />
    </EncoderProfile>

    <EncoderProfile quality="timelapsecif" fileFormat="3gp" duration="30">
      <Video codec="h264"
             bitRate="720000"
             width="352"
             height="288"
             frameRate="30" />

      <Audio codec="amrnb"
             bitRate="12200"
             sampleRate="8000"
             channels="1" />
    </EncoderProfile>

    <EncoderProfile quality="timelapse480p" fileFormat="3gp" duration="30">
      <Video codec="h264"
             bitRate="2000000"
             width="640"
             height="480"
             frameRate="30" />

      <Audio codec="aac"
             bitRate="96000"
             sampleRate="16000"
             channels="1" />
    </EncoderProfile>

    <EncoderProfile quality="timelapseqvga" fileFormat="3gp" duration="30">
      <Video codec="h264"
             bitRate="512000"
             width="320"
             height="240"
             frameRate="30" />

      <Audio codec="aac"
             bitRate="96000"
             sampleRate="16000"
             channels="1" />
    </EncoderProfile>

    <ImageEncoding quality="90" />
    <ImageEncoding quality="80" />
    <ImageEncoding quality="70" />
    <ImageDecoding memCap="2000000" />

  </CamcorderProfiles>

  <!-- Front Camera -->
  <CamcorderProfiles cameraId="1">

    <EncoderProfile quality="low" fileFormat="3gp" duration="30">
      <Video codec="h264"
             bitRate="192000"
             width="176"
             height="144"
             frameRate="30" />

      <Audio codec="amrnb"
             bitRate="12200"
             sampleRate="8000"
             channels="1" />
    </EncoderProfile>

    <EncoderProfile quality="high" fileFormat="3gp" duration="30">
      <Video codec="h264"
             bitRate="2000000"
             width="640"
             height="480"
             frameRate="30" />

      <Audio codec="aac"
             bitRate="96000"
             sampleRate="16000"
             channels="1" />
    </EncoderProfile>

    <EncoderProfile quality="qcif" fileFormat="3gp" duration="30">
      <Video codec="h264"
             bitRate="192000"
             width="176"
             height="144"
             frameRate="30" />

      <Audio codec="amrnb"
             bitRate="12200"
             sampleRate="8000"
             channels="1" />
    </EncoderProfile>

    <EncoderProfile quality="cif" fileFormat="3gp" duration="30">
      <Video codec="h264"
             bitRate="720000"
             width="352"
             height="288"
             frameRate="30" />

      <Audio codec="amrnb"
             bitRate="12200"
             sampleRate="8000"
             channels="1" />
    </EncoderProfile>

    <EncoderProfile quality="480p" fileFormat="3gp" duration="30">
      <Video codec="h264"
             bitRate="2000000"
             width="640"
             height="480"
             frameRate="30" />

      <Audio codec="aac"
             bitRate="96000"
             sampleRate="16000"
             channels="1" />
    </EncoderProfile>

    <EncoderProfile quality="fwvga" fileFormat="3gp" duration="30">
      <Video codec="h264"
             bitRate="2000000"
             width="864"
             height="480"
             frameRate="30" />

      <Audio codec="aac"
             bitRate="96000"
             sampleRate="16000"
             channels="1" />
    </EncoderProfile>

    <EncoderProfile quality="wvga" fileFormat="3gp" duration="30">
      <Video codec="h264"
             bitRate="2000000"
             width="800"
             height="480"
             frameRate="30" />

      <Audio codec="aac"
             bitRate="96000"
             sampleRate="16000"
             channels="1" />
    </EncoderProfile>

     <EncoderProfile quality="vga" fileFormat="3gp" duration="30">
      <Video codec="h264"
             bitRate="2000000"
             width="640"
             height="480"
             frameRate="30" />

      <Audio codec="aac"
             bitRate="96000"
             sampleRate="16000"
             channels="1" />
    </EncoderProfile>

     <EncoderProfile quality="wqvga" fileFormat="3gp" duration="30">
      <Video codec="h264"
             bitRate="720000"
             width="432"
             height="240"
             frameRate="30" />

      <Audio codec="aac"
             bitRate="96000"
             sampleRate="16000"
             channels="1" />
    </EncoderProfile>

        <EncoderProfile quality="qvga" fileFormat="3gp" duration="30">
      <Video codec="h264"
             bitRate="512000"
             width="320"
             height="240"
             frameRate="30" />

      <Audio codec="aac"
             bitRate="96000"
             sampleRate="16000"
             channels="1" />
    </EncoderProfile>

    <EncoderProfile quality="timelapselow" fileFormat="3gp" duration="30">
      <Video codec="h264"
             bitRate="192000"
             width="176"
             height="144"
             frameRate="30" />

      <Audio codec="amrnb"
             bitRate="12200"
             sampleRate="8000"
             channels="1" />
    </EncoderProfile>

    <EncoderProfile quality="timelapsehigh" fileFormat="3gp" duration="30">
      <Video codec="h264"
             bitRate="2000000"
             width="640"
             height="480"
             frameRate="30" />

      <Audio codec="aac"
             bitRate="96000"
             sampleRate="16000"
             channels="1" />
    </EncoderProfile>

    <EncoderProfile quality="timelapseqcif" fileFormat="3gp" duration="30">
      <Video codec="h264"
             bitRate="192000"
             width="176"
             height="144"
             frameRate="30" />

      <Audio codec="amrnb"
             bitRate="12200"
             sampleRate="8000"
             channels="1" />
    </EncoderProfile>

    <EncoderProfile quality="timelapsecif" fileFormat="3gp" duration="30">
      <Video codec="h264"
             bitRate="720000"
             width="352"
             height="288"
             frameRate="30" />

      <Audio codec="amrnb"
             bitRate="12200"
             sampleRate="8000"
             channels="1" />
    </EncoderProfile>

    <EncoderProfile quality="timelapse480p" fileFormat="3gp" duration="30">
      <Video codec="h264"
             bitRate="2000000"
             width="640"
             height="480"
             frameRate="30" />

      <Audio codec="aac"
             bitRate="96000"
             sampleRate="16000"
             channels="1" />
    </EncoderProfile>

    <EncoderProfile quality="timelapseqvga" fileFormat="3gp" duration="30">
      <Video codec="h264"
             bitRate="512000"
             width="320"
             height="240"
             frameRate="30" />

      <Audio codec="aac"
             bitRate="96000"
             sampleRate="16000"
             channels="1" />
    </EncoderProfile>

    <ImageEncoding quality="90" />
    <ImageEncoding quality="80" />
    <ImageEncoding quality="70" />
    <ImageDecoding memCap="2000000" />

  </CamcorderProfiles>

  <EncoderOutputFileFormat name="3gp" />

  <!--
         If a codec is not enabled, it is invisible to the applications
         In other words, the applications won't be able to use the codec
         or query the capabilities of the codec at all if it is disabled
    -->
  <VideoEncoderCap name="h264" enabled="true"
      minBitRate="64000" maxBitRate="4000000"
      minFrameWidth="176" maxFrameWidth="1280"
      minFrameHeight="144" maxFrameHeight="720"
      minFrameRate="1" maxFrameRate="30" />

  <VideoEncoderCap name="h263" enabled="true"
      minBitRate="64000" maxBitRate="8000000"
      minFrameWidth="176" maxFrameWidth="864"
      minFrameHeight="144" maxFrameHeight="480"
      minFrameRate="1" maxFrameRate="30" />

  <VideoEncoderCap name="m4v" enabled="true"
      minBitRate="64000" maxBitRate="2000000"
      minFrameWidth="176" maxFrameWidth="864"
      minFrameHeight="144" maxFrameHeight="480"
      minFrameRate="1" maxFrameRate="30" />

  <AudioEncoderCap name="aac" enabled="true"
      minBitRate="8000" maxBitRate="320000"
      minSampleRate="8000" maxSampleRate="48000"
      minChannels="1" maxChannels="1" />

  <AudioEncoderCap name="amrwb" enabled="true"
        minBitRate="6600" maxBitRate="23050"
        minSampleRate="16000" maxSampleRate="16000"
        minChannels="1" maxChannels="1" />

  <AudioEncoderCap name="amrnb" enabled="true"
      minBitRate="4750" maxBitRate="12200"
      minSampleRate="8000" maxSampleRate="8000"
      minChannels="1" maxChannels="1" />

  <AudioEncoderCap name="lpcm" enabled="true"
      minBitRate="768000" maxBitRate="4608000"
      minSampleRate="48000" maxSampleRate="48000"
      minChannels="1" maxChannels="6" />

  <VideoDecoderCap name="wmv" enabled="true"/>
  <AudioDecoderCap name="wma" enabled="true"/>

  <VideoEditorCap maxInputFrameWidth="1280" maxInputFrameHeight="720" maxOutputFrameWidth="1280" maxOutputFrameHeight="720" maxPrefetchYUVFrames="3" />  

  <ExportVideoProfile name="h263" profile="1" level="1"/>
  <ExportVideoProfile name="h264" profile="1" level="1"/>
  <ExportVideoProfile name="m4v" profile="1" level="1"/>

</MediaSettings>
